{
  "analysis_config": {
    "limits": {
      "max_cfg_paths_per_function": 64,
      "max_cfg_steps_per_function": 4096,
      "max_cfi_bytes": 8388608,
      "max_cfi_instructions": 200000,
      "max_cfi_records": 4096,
      "max_cfi_rows": 50000,
      "max_evidence_per_function": 32,
      "max_file_bytes": 536870912,
      "max_functions": 50000,
      "max_instructions_per_function": 16384,
      "max_load_commands": 4096,
      "max_observations_per_function": 256,
      "max_sections": 4096,
      "max_total_cfg_steps": 100000,
      "max_total_evidence": 8192,
      "max_total_instructions": 1000000,
      "max_unwind_entries": 200000
    }
  },
  "findings": [
    {
      "checked_pcs": [
        "0x1000"
      ],
      "coverage": "compact",
      "encoding": "0x02000000",
      "evidence": [
        {
          "code": "caller_state_recovered",
          "message": "Modeled recovery preserves entry SP and original x19\u2013x30 at every listed conservative CFG observation"
        },
        {
          "code": "cfg_paths_checked",
          "message": "1 terminal paths checked; 0 with uncertain reachability; 2 state visits; 1 path-state observations; states retained separately at reconvergence"
        }
      ],
      "function": {
        "address": "0x1000",
        "boundary_source": "lc_function_starts",
        "end_address": "0x1008",
        "image_offset": "0x0",
        "name": "owned_udiv_witness",
        "size": 8
      },
      "id": "airsf-a15c70cabe2cea22dfede53ef4db19b4a2209a2e3f5854bde91a64c43a09713c",
      "instruction_count": 2,
      "limitations": [
        "Only the documented, bounded integer instruction subset is interpreted.",
        "Checks describe selected modeled states; they do not establish whole-function or asynchronous unwind correctness.",
        "SIMD, pointer authentication, CFI outside the bounded subset, personality and LSDA semantics are outside this model.",
        "Leaf observations are states before identified body instructions, excluding recognized prologue and epilogue transitions.",
        "Only forward acyclic compact-frameless leaf paths with independently checked return stack regions with bounded forward EQ\u2013LE or unconditional suffix transfers are modeled; no calls or CFI CFG extension.",
        "Unknown supported NZCV conditions explore both successors without merging identities; possible-only discrepancies remain unresolved."
      ],
      "mode": "frameless",
      "reason_codes": [
        "supported_model_agreement"
      ],
      "scope": "modeled_leaf_body",
      "verdict": "agreement"
    }
  ],
  "generator": {
    "analysis_model_version": "arm64-bounded-udiv-v34",
    "name": "AIRS",
    "version": "0.2.0"
  },
  "image": {
    "architecture": "arm64",
    "container_sha256": "1111111111111111111111111111111111111111111111111111111111111111",
    "cpu_subtype": 0,
    "display_name": "synthetic-udiv.bin",
    "file_type": "dylib",
    "preferred_base": "0x1000",
    "slice_offset": 0,
    "slice_sha256": "2222222222222222222222222222222222222222222222222222222222222222",
    "slice_size": 8,
    "uuid": null
  },
  "issues": [],
  "limitations": [
    "This is a bounded static model, not a proof that a binary always unwinds correctly.",
    "Compact unwind is checked at supported synchronous call states or explicitly labeled leaf-body states; no asynchronous or all-PC guarantee is made.",
    "Unsupported instructions, flow outside the bounded CFG and at-most-two sequential disjoint natural-loop subset, unsupported CFI, ARM64e/PAC and SIMD saves remain unresolved.",
    "Exception personalities, LSDA behavior, runtime stack contents and executable behavior are not validated.",
    "The inspected file is read as data and is never loaded or executed.",
    "Selecting a .app analyzes its principal executable; embedded images are not recursively scanned in this version."
  ],
  "metadata_ranges": [
    {
      "encoding": "0x02000000",
      "end": "0x1008",
      "mode": "frameless",
      "start": "0x1000"
    }
  ],
  "report_kind": "airs.audit",
  "schema_version": 1,
  "summary": {
    "agreement_count": 1,
    "checked_pc_count": 1,
    "function_count": 1,
    "inconsistency_count": 0,
    "metadata_entry_count": 1,
    "unresolved_count": 0
  }
}
