{
  "analysis_config": {
    "limits": {
      "max_cfg_paths_per_function": 64,
      "max_cfg_steps_per_function": 4096,
      "max_cfi_bytes": 8388608,
      "max_cfi_instructions": 200000,
      "max_cfi_records": 4096,
      "max_cfi_rows": 50000,
      "max_evidence_per_function": 32,
      "max_file_bytes": 536870912,
      "max_functions": 50000,
      "max_instructions_per_function": 16384,
      "max_load_commands": 4096,
      "max_observations_per_function": 256,
      "max_sections": 4096,
      "max_total_cfg_steps": 100000,
      "max_total_evidence": 8192,
      "max_total_instructions": 1000000,
      "max_unwind_entries": 200000
    }
  },
  "findings": [
    {
      "checked_pcs": [
        "0x1008",
        "0x100c"
      ],
      "coverage": "compact",
      "encoding": "0x04000000",
      "evidence": [
        {
          "address": "0x1000",
          "code": "equivalent_compact_ranges",
          "message": "Identical contiguous compact rules cover this function; original metadata ranges are retained",
          "observed": "2 original ranges; shared encoding=0x04000000"
        },
        {
          "code": "caller_state_recovered",
          "message": "The unwind rule recovers entry SP and original x19\u2013x30 at every listed modeled observation"
        }
      ],
      "function": {
        "address": "0x1000",
        "boundary_source": "lc_function_starts",
        "end_address": "0x1018",
        "image_offset": "0x0",
        "name": "owned_rbit_candidate",
        "size": 24
      },
      "id": "airsf-f7ad36edfdc2d2b7082f9f4b1a4be93144d088c7d42c77b3cbd14562831c7306",
      "instruction_count": 6,
      "limitations": [
        "Only the documented, bounded integer instruction subset is interpreted.",
        "Checks describe selected modeled states; they do not establish whole-function or asynchronous unwind correctness.",
        "SIMD, pointer authentication, CFI outside the bounded subset, personality and LSDA semantics are outside this model.",
        "Direct callees are summarized as ABI-conforming returns preserving SP, x19\u2013x29 and unescaped allocated stack storage; callees are not analyzed."
      ],
      "mode": "frame",
      "reason_codes": [
        "supported_model_agreement"
      ],
      "scope": "synchronous_call_sites",
      "verdict": "agreement"
    },
    {
      "checked_pcs": [
        "0x1100"
      ],
      "coverage": "compact",
      "encoding": "0x02000000",
      "evidence": [
        {
          "code": "caller_state_recovered",
          "message": "The unwind rule recovers entry SP and original x19\u2013x30 at every listed modeled observation"
        }
      ],
      "function": {
        "address": "0x1100",
        "boundary_source": "lc_function_starts",
        "end_address": "0x1108",
        "image_offset": "0x100",
        "name": "owned_sink",
        "size": 8
      },
      "id": "airsf-13f8076209156d06625f372009bf2e7bb48c8cb45f8438b30a9080d5d9ca04a7",
      "instruction_count": 2,
      "limitations": [
        "Only the documented, bounded integer instruction subset is interpreted.",
        "Checks describe selected modeled states; they do not establish whole-function or asynchronous unwind correctness.",
        "SIMD, pointer authentication, CFI outside the bounded subset, personality and LSDA semantics are outside this model.",
        "Leaf observations are states before identified body instructions, excluding recognized prologue and epilogue transitions."
      ],
      "mode": "frameless",
      "reason_codes": [
        "supported_model_agreement"
      ],
      "scope": "modeled_leaf_body",
      "verdict": "agreement"
    }
  ],
  "generator": {
    "analysis_model_version": "arm64-bounded-equivalent-compact-v39",
    "name": "AIRS",
    "version": "0.2.0"
  },
  "image": {
    "architecture": "arm64",
    "container_sha256": "1111111111111111111111111111111111111111111111111111111111111111",
    "cpu_subtype": 0,
    "display_name": "typed.bin",
    "file_type": "dylib",
    "preferred_base": "0x1000",
    "slice_offset": 0,
    "slice_sha256": "2222222222222222222222222222222222222222222222222222222222222222",
    "slice_size": 264,
    "uuid": null
  },
  "issues": [],
  "limitations": [
    "This is a bounded static model, not a proof that a binary always unwinds correctly.",
    "Compact unwind is checked at supported synchronous call states or explicitly labeled leaf-body states; no asynchronous or all-PC guarantee is made.",
    "Unsupported instructions, flow outside the bounded CFG and at-most-two sequential disjoint natural-loop subset, unsupported CFI, ARM64e/PAC and SIMD saves remain unresolved.",
    "Exception personalities, LSDA behavior, runtime stack contents and executable behavior are not validated.",
    "The inspected file is read as data and is never loaded or executed.",
    "Selecting a .app analyzes its principal executable; embedded images are not recursively scanned in this version."
  ],
  "metadata_ranges": [
    {
      "encoding": "0x04000000",
      "end": "0x100c",
      "mode": "frame",
      "start": "0x1000"
    },
    {
      "encoding": "0x04000000",
      "end": "0x1018",
      "mode": "frame",
      "start": "0x100c"
    },
    {
      "encoding": "0x02000000",
      "end": "0x1108",
      "mode": "frameless",
      "start": "0x1100"
    }
  ],
  "report_kind": "airs.audit",
  "schema_version": 1,
  "summary": {
    "agreement_count": 2,
    "checked_pc_count": 3,
    "function_count": 2,
    "inconsistency_count": 0,
    "metadata_entry_count": 3,
    "unresolved_count": 0
  }
}
